{
  "$schema": "https://raw.githubusercontent.com/brpowell/spiral/main/libs/spk-format/schemas/viz-v1.schema.json",
  "id": "bump-juice",
  "name": "Bump Juice",
  "author": "Spiral",
  "description": "Liquid with the rhythm.",
  "children": [
    {
      "kind": "canvas",
      "layout": "fill",
      "entry": "index.js"
    }
  ]
}
