{
  "$schema": "https://raw.githubusercontent.com/spiral-powered/spk-format/main/schemas/viz-v1.schema.json",
  "id": "band",
  "name": "Band",
  "author": "Spiral",
  "description": "Plucking a rubber band to bass bulges and treble ripples.",
  "children": [
    {
      "kind": "canvas",
      "layout": "fill",
      "entry": "index.js"
    }
  ]
}
