{
  "$schema": "https://raw.githubusercontent.com/spiral-powered/spk-format/main/schemas/viz-v1.schema.json",
  "id": "dream-cube",
  "name": "Dream Cube",
  "author": "Spiral",
  "description": "Those little rascals are living it up out there in the ether.",
  "children": [
    {
      "id": "dream",
      "kind": "webgl",
      "layout": "fill",
      "entry": "index.js"
    }
  ]
}
