{
  "$schema": "https://raw.githubusercontent.com/brpowell/spiral/main/libs/spk-format/schemas/viz-v1.schema.json",
  "id": "pulse",
  "name": "Pulse",
  "author": "Spiral",
  "description": "A sharp waveform to feel the punches.",
  "children": [
    {
      "kind": "canvas",
      "layout": "fill",
      "entry": "index.js"
    }
  ]
}
