{
  "$schema": "https://raw.githubusercontent.com/brpowell/spiral/main/libs/spk-format/schemas/viz-v1.schema.json",
  "id": "pixels",
  "name": "Pixels",
  "author": "Spiral",
  "description": "Pixel bars playing keepie uppie with peak caps.",
  "children": [
    {
      "kind": "canvas",
      "layout": "fill",
      "entry": "index.js"
    }
  ]
}
