{
  "$schema": "https://raw.githubusercontent.com/brpowell/spiral/main/libs/spk-format/schemas/viz-v1.schema.json",
  "id": "bars",
  "name": "Bars",
  "author": "Spiral",
  "description": "I wonder if you put a pin art board on top of a speaker if it would do this.",
  "children": [
    {
      "kind": "canvas",
      "layout": "fill",
      "entry": "index.js"
    }
  ]
}
